Name,Group,Category,Price,Website,Description,More,Date
SaaS Boilerplate Pro,Templates,Nextjs,Paid,https://nextjs-boilerplate.com/pro-saas-starter-kit,"Boilerplate and Starter for Next JS 14+, Tailwind CSS 3.4 and TypeScript",https://www.indiehackers.site/product/saas-boilerplate-pro,2024/06/16
Next Auth Roles Template,Templates,Nextjs,Free,https://next-auth-roles-template.vercel.app,"Open-source Nextjs 14 Template Starter with Auth.js v5, User Roles & Admin Panel.",https://www.indiehackers.site/product/next-auth-roles-template,2024/07/09
Cult Directory Template,Templates,Nextjs,Free,https://www.nextjs.design,A full stack nextjs + shadcn + supabase template,https://www.indiehackers.site/product/cult-directory-template,2024/06/22
SaaS Boilerplate,Templates,Nextjs,Free,https://github.com/ixartz/SaaS-Boilerplate,"Boilerplate and Starter for Next JS 14+, Tailwind CSS 3.4 and TypeScript",https://www.indiehackers.site/product/saas-boilerplate,2024/06/08
Saasfly,Templates,Nextjs,Free,https://show.saasfly.io,An easy-to-use and enterprise-grade Next.js boilerplate.,https://www.indiehackers.site/product/saasfly,2024/06/08
Supastarter Nextjs,Templates,Nextjs,Paid,https://supastarter.dev?aff=MEzPR,Ship your SaaS in days. Save time and focus on your business with our production-ready SaaS starter kits for Next.js 14 and Nuxt 3.,https://www.indiehackers.site/product/supastarter-nextjs,2024/06/08
Open Saas,Templates,Nextjs,Free,https://opensaas.sh,"An open-source, feature-rich, full-stack React + NodeJS template that manages features for you.",https://www.indiehackers.site/product/open-saas,2024/06/24
Nextjs Billing,Templates,Nextjs,Free,https://github.com/lmsqueezy/nextjs-billing,Next.js billing app with Lemon Squeezy,https://www.indiehackers.site/product/nextjs-billing,2024/06/08
Next.js Templates,Templates,Nextjs,Free & Paid,https://nextjstemplates.com,"Free Next.js Boilerplates, Templates and Starters",https://www.indiehackers.site/product/next-js-templates,2024/06/30
Shipixen,Templates,Nextjs,Paid,https://shipixen.com?aff=MEzPR,"Branded boilerplates for your website, product or blog. Get an SEO optimized Markdown blog running Next.js 14, TypeScript, TailwindCSS + Shadcn UI. Deploy to Vercel with 1 click.",https://www.indiehackers.site/product/shipixen,2024/06/16
PXCI Boilerplate,Templates,Nextjs,Free,https://github.com/inngest/next-pxci-starter,"Boilerplate Next.js project (Xata, Prisma, Inngest, Clerk)",https://www.indiehackers.site/product/pxci-boilerplate,2024/07/10
SaaSy Land,Templates,Nextjs,Free,https://www.saasyland.com,"Your shortcut to startup success. The ultimate, modern, open-source Next.js template, with everything you need set up and ready to use.",https://www.indiehackers.site/product/saasy-land,2024/07/10
Shipfast,Templates,Nextjs,Paid,https://shipfa.st/?via=javay,"Ship your startup in days, not weeks. The NextJS boilerplate with all you need to build your SaaS, AI tool, or any other web app and make your first $ online fast.",https://www.indiehackers.site/product/shipfast,2024/06/03
Next SaaS Stripe Starter,Templates,Nextjs,Free,https://next-saas-stripe-starter.vercel.app,"Open-source SaaS Starter with User Roles & Admin Panel. Built using Next.js 14, Prisma, Neon, Auth.js v5, Resend, React Email, Shadcn/ui, Stripe, Server Actions.",https://www.indiehackers.site/product/next-saas-stripe-starter,2024/07/09
Inbox Zero,Templates,Nextjs,Free & Paid,https://www.getinboxzero.com,"Automate your email with AI, bulk unsubscribe from newsletters, and block cold emails. Open-source.",https://www.indiehackers.site/product/inbox-zero,2024/07/10
Next.JS Boilerplates,Templates,Nextjs,Free,https://www.nextjsboilerplateslist.com,Search Next.JS boilerplates based on wide range of categories and technologies.,https://www.indiehackers.site/product/next-js-boilerplates,2024/07/10
T3,Templates,Nextjs,Free,https://create.t3.gg,"The best way to start a full-stack, typesafe Next.js app",https://www.indiehackers.site/product/t3,2024/06/30
Shipped,Templates,Nextjs,Paid,https://shipped.club?aff=MEzPR,"Launch your startup in days, not months The Next.js Startup Boilerplate for busy founders, with all you need to build and launch your startup soon.",https://www.indiehackers.site/product/shipped,2024/06/09
AstroWind,Templates,Astro,Free,https://astrowind.vercel.app,AstroWind: A free template using Astro 4.0 and Tailwind CSS. Astro starter theme.,https://www.indiehackers.site/product/astrowind,2024/07/02
Astrolus,Templates,Astro,Free,https://astrolus.netlify.app,Home page template built with astro and tailwindcss using tailus blocks,https://www.indiehackers.site/product/astrolus,2024/07/02
Astroplate,Templates,Astro,Free,https://zeon.studio/preview?project=astroplate,"Astroplate is a free starter template built with Astro, TailwindCSS & TypeScript providing everything you need to jumpstart your Astro project. Get started with Astroplate and save yourself hours of work!",https://www.indiehackers.site/product/astroplate,2024/07/02
AstroShip,Templates,Astro,Free,https://astroship.web3templates.com,"Astroship is a starter template for startups, marketing websites & landing pages. Built with Astro.build and TailwindCSS. You can quickly create any website with this starter.",https://www.indiehackers.site/product/astroship,2024/07/02
Astronomy,Templates,Astro,Free,https://astro-nomy.vercel.app,An open source application built using the latest features in Astro v4 with shadcn/ui.,https://www.indiehackers.site/product/astronomy,2024/07/02
Tailcast,Templates,Astro,Free,https://tailcast.vercel.app,"Dark themed website template built on AstroJS, designed for fictional startup",https://www.indiehackers.site/product/tailcast,2024/07/02
Supastarter Nuxt,Templates,Nuxt,Paid,https://supastarter.dev?aff=MEzPR,Ship your SaaS in days. Save time and focus on your business with our production-ready SaaS starter kits for Next.js 14 and Nuxt 3.,https://www.indiehackers.site/product/supastarter-nuxt,2024/06/08
Rapid Launch,Templates,Nuxt,Paid,https://rapidlaunch.it?via=sr34xt8k5nl3ddcgul2j,Rapid Launch is a Nuxt-based boilerplate designed for creating and deploying landing pages for SaaS products and web apps. Users purchase the boilerplate code and deploy it themselves.,https://www.indiehackers.site/product/rapid-launch,2024/06/16
sidebase,Templates,Nuxt,Paid,https://sidebase.io,The productive way to build fullstack Nuxt 3 applications.,https://www.indiehackers.site/product/sidebase,2024/07/10
NuxtBase,Templates,Nuxt,Paid,https://nuxtbase.site,基于NuxtJS的前端脚手架，集成了你开发项目的一切工具（登录 + 支付 + 前后端）。让Vue和NodeJS开发者能够快速上线你的AI应用！,https://www.indiehackers.site/product/nuxtbase,2024/07/11
Just Launch It,Templates,Svelte,Paid,https://www.justlaunch.it,"A fully-loaded SvelteKit boilerplate to rapidly build and launch your unicorn SaaS, AI or web startup so you can get to market faster.",https://www.indiehackers.site/product/just-launch-it,2024/06/16
One Page Love,Templates,Landing Page,Free,https://onepagelove.com,"One Page websites, curated.",https://www.indiehackers.site/product/one-page-love,2024/06/30
Page UI,Templates,Landing Page,Free,https://pageui.shipixen.com,Landing page components that look great & convert,https://www.indiehackers.site/product/page-ui,2024/06/16
SaaS Landing Page,Templates,Landing Page,Free,https://saaslandingpage.com,SaaS landing page examples,https://www.indiehackers.site/product/saas-landing-page,2024/06/24
Landing Page Boilerplate,Templates,Landing Page,Free,https://landingpage.weijunext.com,"A versatile landing page boilerplate, ideal for various projects and marketing campaigns.",https://www.indiehackers.site/product/landing-page-boilerplate,2024/06/24
WXT,Templates,Browser Extension,Free,https://wxt.dev,An open source tool that makes Chrome Extension development faster than ever before,https://www.indiehackers.site/product/wxt,2024/06/24
Plasmo,Templates,Browser Extension,Free & Paid,https://www.plasmo.com,"Plasmo helps you build, test, and deploy powerful, cutting-edge products on top of the web browser.",https://www.indiehackers.site/product/plasmo,2024/06/24
Quartz,Templates,Documentation,Free,https://quartz.jzhao.xyz,"Quartz is a fast, batteries-included static-site generator that transforms Markdown content into fully functional websites.",https://www.indiehackers.site/product/quartz,2024/06/25
Nextra,Templates,Documentation,Free,https://nextra.site,"Simple, powerful and flexible site generation framework with everything you love from Next.js",https://www.indiehackers.site/product/nextra,2024/06/25
Mintlify,Templates,Documentation,Free & Paid,https://mintlify.com,"The documentation you want, effortlessly. Meet the modern standard for public facing documentation. Beautiful out of the box, easy to maintain, and optimized for user engagement.",https://www.indiehackers.site/product/mintlify,2024/06/30
VitePress,Templates,Documentation,Free,https://vitepress.dev,Vite & Vue Powered Static Site Generator,https://www.indiehackers.site/product/vitepress,2024/06/25
Docsify,Templates,Documentation,Free,https://docsify.js.org,A magical documentation site generator,https://www.indiehackers.site/product/docsify,2024/06/25
Starlight,Templates,Documentation,Free,https://starlight.astro.build,"Everything you need to build a stellar documentation website. Fast, accessible, and easy-to-use.",https://www.indiehackers.site/product/starlight,2024/06/25
VuePress,Templates,Documentation,Free,https://vuepress.vuejs.org,Vue-powered Static Site Generator,https://www.indiehackers.site/product/vuepress,2024/06/25
Docusaurus,Templates,Documentation,Free,https://docusaurus.io,"Build optimized websites quickly, focus on your content",https://www.indiehackers.site/product/docusaurus,2024/06/25
Hexo,Templates,Blog,Free,https://hexo.io,"A fast, simple & powerful blog framework, powered by Node.js.",https://www.indiehackers.site/product/hexo,2024/06/27
Jekyll,Templates,Blog,Free,https://jekyllrb.com,Transform your plain text into static websites and blogs.,https://www.indiehackers.site/product/jekyll,2024/06/26
Hugo,Templates,Blog,Free,https://gohugo.io,The world’s fastest framework for building websites,https://www.indiehackers.site/product/hugo,2024/06/27
Cali.so,Templates,Blog,Free,https://cali.so,An open source blog system with beautiful UI and full features ,https://www.indiehackers.site/product/cali-so,2024/06/28
AI Background Remover,Tools,Image,Free,https://html.zone/background-remover,Free AI Background Remover Tool,https://www.indiehackers.site/product/ai-background-remover,2024/06/29
Magickimg,Tools,Image,Free & Paid,https://magickimg.com,MagickImg 提供免费在线工具，用于捕捉任何网站的全页截图，并提供其他 AI 图像处理工具。,https://www.indiehackers.site/product/magickimg,2024/06/01
imgto,Tools,Image,Free,https://imgto.xyz,"Easily optimize and convert your images to modern, efficent formats for free using imgto.xyz.",https://www.indiehackers.site/product/imgto,2024/07/10
TinyPng,Tools,Image,Free & Paid,https://tinypng.com,"Smart WebP, PNG and JPEG Compression for Faster Websites",https://www.indiehackers.site/product/tinypng,2024/06/22
Removerized,Tools,Image,Free,https://removerized.tech,Free AI Background Remover Tool,https://www.indiehackers.site/product/removerized,2024/06/22
Xnapper,Tools,Image,Free & Paid,https://xnapper.com,Snap Beautiful Screenshots Instantly,https://www.indiehackers.site/product/xnapper,2024/06/22
Clipdrop,Tools,Image,Free & Paid,https://clipdrop.co,"Clipdrop.co offers a suite of AI-powered tools for creating and editing images, including background removal, resizing, object deletion, and more, with options for both web and API integration.",https://www.indiehackers.site/product/clipdrop,2024/06/22
Canva,Tools,Image,Free & Paid,https://www.canva.com,Canva makes it easy to create professional designs and to share or print them.,https://www.indiehackers.site/product/canva,2024/06/22
Bookmark.style,Tools,Image,Free,https://www.bookmark.style,"Turn any link into a stylish visual web bookmark, one-click to copy the beautiful web bookmark image.",https://www.indiehackers.site/product/bookmark-style,2024/06/27
Background Removal,Tools,Image,Free,https://img.ly/showcases/cesdk/background-removal/web,Remove backgrounds from images directly in the browser environment with ease and no additional costs or privacy concerns.,https://www.indiehackers.site/product/background-removal,2024/07/06
Zipic,Tools,Image,Free & Paid,https://store.5km.tech?aff=MEzPR,Zipic 是一款高效的图片压缩工具，支持 JPEG、PNG、WebP、HEIC 等格式压缩和转换。它提供极速压缩、高质量输出、视觉无损、批量处理、调整尺寸等功能，本地压缩保护隐私，支持亮暗主题和 Raycast 扩展，满足个人和工作需求。,https://www.indiehackers.site/product/zipic,2024/06/16
AnimStats,Tools,Video,Free & Paid,https://www.animstats.com,"Get x10 more engagement, grab attention with Animated GIFs/Videos",https://www.indiehackers.site/product/animstats,2024/06/20
Focusee,Tools,Video,Free & Paid,https://gemoo.com/focusee/?ref=zjq3yzu,Turn Screen Recordings into Eye-Catching Videos Automatically,https://www.indiehackers.site/product/focusee,2024/06/25
Pika Code Screenshot,Tools,Code,Free & Paid,https://pika.style/templates/code-image,"Free tool to create code screenshots for 20+ languages including HTML, CSS, JavaScript",https://www.indiehackers.site/product/pika-code-screenshot,2024/06/21
Carbon,Tools,Code,Free,https://carbon.now.sh,Create and share beautiful images of your source code. Start typing or drop a file into the text area to get started.,https://www.indiehackers.site/product/carbon-code-to-image,2024/06/19
CodeBit,Tools,Code,Free & Paid,https://codebit.xyz,Just a few steps to create your animated code video,https://www.indiehackers.site/product/codebit,2024/06/20
Ray.so,Tools,Code,Free,https://ray.so,Free tool to create code screenshots,https://www.indiehackers.site/product/ray-so,2024/06/22
Hackreels,Tools,Code,Free & Paid,https://www.hackreels.com,"Animate your code, in HD.",https://www.indiehackers.site/product/hackreels,2024/06/19
Buildkite,Tools,Dev,Free & Paid,https://buildkite.com,Jumpstart your Continuous Integration pipeline in minutes,https://www.indiehackers.site/product/buildkite,2024/06/22
ScreenshotOne,Tools,Dev,Paid,https://screenshotone.com,"Render screenshots in one simple API call, instead of managing browser clusters, and handling all the corner cases.",https://www.indiehackers.site/product/screenshotone,2024/07/06
Trigger.dev,Tools,Dev,Free & Paid,https://trigger.dev,Open source background jobs with no timeouts,https://www.indiehackers.site/product/trigger-dev,2024/07/06
UI Lib Picker,Tools,Dev,Free,https://ui-libs.vercel.app,Pick the right UI Library  for your Vue 3 or Nuxt 3 Project.,https://www.indiehackers.site/product/ui-lib-picker,2024/06/22
Monorepo,Tools,Dev,Free,https://monorepo.tools,"Everything you need to know about monorepos, and the tools to build them",https://www.indiehackers.site/product/monorepo,2024/06/23
Proxyman,Tools,Dev,Free & Paid,https://proxyman.io,"Best-in-class native macOS app to capture, decrypt, and mock  your HTTP(s) requests/ responses with powerful debugging tools.",https://www.indiehackers.site/product/proxyman,2024/06/22
Wappalyzer,Tools,Dev,Free & Paid,https://www.wappalyzer.com,Identify technologies on websites,https://www.indiehackers.site/product/wappalyzer,2024/06/20
bruno,Tools,Dev,Free & Paid,https://www.usebruno.com,"Bruno is a Fast and Git-Friendly Opensource API client, aimed at revolutionizing the status quo represented by Postman, Insomnia and similar tools out there.",https://www.indiehackers.site/product/bruno,2024/06/22
Open Graph Image Kit,Tools,OG Image,Paid,https://ogimage.org?aff=MEzPR,"All the code you need to create infinite open graph images for your website, blog, or social media posts.",https://www.indiehackers.site/product/open-graph-image-kit,2024/06/16
OG Image Gallery,Tools,OG Image,Free,https://www.ogimage.gallery,Gallery with the best and most carefully collected OG images by Luc Chaissac.,https://www.indiehackers.site/product/og-image-gallery,2024/06/15
OpenGraph.xyz,Tools,OG Image,Free & Paid,https://www.opengraph.xyz,Preview and Generate Open Graph Meta Tags,https://www.indiehackers.site/product/opengraph-xyz,2024/06/29
OG Image Generator,Tools,OG Image,Free,https://tailwind-generator.com/og-image-generator/generator,Design beautiful open graph images for your website using a graphical editor. Easily export the created og images as PNG format.,https://www.indiehackers.site/product/og-image-generator,2024/06/15
Marketing Examples,Tools,Social & Market,Free,https://marketingexamples.com,"Marketing Examples is a comprehensive resource offering insights into various marketing strategies, including acquisition, conversion, retention, and brand, through real-world examples, tips, and industry news, delivered via a highly regarded newsletter.",https://www.indiehackers.site/product/marketing-examples,2024/07/12
F5Bot,Tools,Social & Market,Free,https://f5bot.com,"F5Bot is a free service that emails you when your selected keywords are mentioned on Reddit, Hacker News, or Lobsters. Use it to monitor your brand, your projects, or just topics that you're interested in.",https://www.indiehackers.site/product/f5bot,2024/06/26
Dify,Tools,AI,Free & Paid,https://dify.ai,"Dify is an open-source LLM app development platform. Orchestrate LLM apps from agents to complex AI workflows, with an RAG engine.  More production-ready than LangChain",https://www.indiehackers.site/product/dify,2024/06/23
v0.dev,Tools,AI,Free & Paid,https://v0.dev,Generate UI with shadcn/ui from simple text prompts and images.,https://www.indiehackers.site/product/v0-dev,2024/06/09
ChatGPT,Tools,AI,Free & Paid,https://openai.com,"ChatGPT is an AI-powered conversational agent that can engage in natural language conversations, provide information, and assist users with various tasks.",https://www.indiehackers.site/product/chatgpt,2024/06/01
Riffo,Tools,AI,Free,https://riffo.ai/?utm_source=twitter&utm_medium=kol&utm_term=javayhu,Your AI helper that saves hours of file guesswork,https://www.indiehackers.site/product/riffo,2024/06/22
Flowise AI,Tools,AI,Free,https://flowiseai.com,Open source low-code tool for developers to build customized LLM orchestration flow & AI agents,https://www.indiehackers.site/product/flowise-ai,2024/06/23
Coze,Tools,AI,Free,https://www.coze.com,"Coze is a one-stop AI chat bot development platform. Regardless of your programming skills, Coze allows you to swiftly create a wide range of chat bots powered by AI, capable of handling everything from simple questions to complex conversations. Furthermore, you can publish your bots to various applications, fostering dynamic interaction with users on those applications.",https://www.indiehackers.site/product/coze,2024/06/23
ScreenshotToCode,Tools,AI,Free & Paid,https://screenshottocode.com,Build User Interfaces 10x Faster.   Convert any screenshot or design to clean code (with support for most frameworks),https://www.indiehackers.site/product/screenshottocode,2024/06/09
GPTZero,Tools,AI,Free & Paid,https://gptzero.me,More than an AI detector Preserve What's Human,https://www.indiehackers.site/product/gptzero,2024/06/23
transform,Tools,Other Tools,Free,transform.tools,A polyglot web converter,https://www.indiehackers.site/product/transform,2024/07/12
Sink,Tools,Link,Free,https://sink.cool,"A Simple / Speedy / Secure Link Shortener with Analytics, 100% run on Cloudflare.",https://www.indiehackers.site/product/sink,2024/06/16
Notion,Tools,Note,Free & Paid,https://www.notion.so,"Write, plan, organize, play Turn ideas into action with Notion’s AI-powered workspace.",https://www.indiehackers.site/product/notion,2024/06/20
Octoparse,Tools,Other Tools,Free & Paid,https://www.octoparse.com,Easy Web Scraping for Anyone,https://www.indiehackers.site/product/octoparse,2024/06/23
Dub,Tools,Link,Free & Paid,https://dub.co,Dub.co is the open-source link management infrastructure for modern marketing teams.,https://www.indiehackers.site/product/dub,2024/06/16
Muenzo,Tools,Note,Free & Paid,https://muenzo.com,"Muenzo is a visual note-taking app to capture ideas, organize thoughts and bring your creativity to life",https://www.indiehackers.site/product/muenzo,2024/06/20
Jina Reader,Tools,Other Tools,Free,https://jina.ai/reader,Convert any URL to an LLM-friendly input with a simple prefix https://r.jina.ai/,https://www.indiehackers.site/product/jina-reader,2024/06/23
HeptaBase,Tools,Note,Free & Paid,https://heptabase.com,"Heptabase empowers you to visually make sense of your learning, research, and projects.",https://www.indiehackers.site/product/heptabase,2024/06/20
Firecrawl,Tools,Other Tools,Free & Paid,https://www.firecrawl.dev,Crawl and convert any website into clean markdown or structured data. It's also open-source,https://www.indiehackers.site/product/firecrawl,2024/06/23
AFFiNE,Tools,Note,Free & Paid,https://affine.pro,"AFFiNE is an open-source, all-in-one workspace and an operating system for all the building blocks that assemble your knowledge base and much more — wiki, knowledge management, presentation and digital assets. It’s a better alternative to Notion and Miro.",https://www.indiehackers.site/product/affine,2024/06/20
Obsidian,Tools,Note,Free & Paid,https://obsidian.md,Obsidian is the private and flexible writing app that adapts to the way you think.,https://www.indiehackers.site/product/obsidian,2024/06/20
shiki-magic-move,Tools,Other Tools,Free,https://github.com/shikijs/shiki-magic-move,"Shiki Magic Move is a low-level library for animating code blocks, and uses Shiki as the syntax highlighter. You usually want to use it with a high-level integration like Slidev.",https://www.indiehackers.site/product/shiki-magic-move,2024/06/22
Parsehub,Tools,Other Tools,Free & Paid,https://www.parsehub.com,"ParseHub is a free and powerful web scraping tool. With our advanced web scraper, extracting data is as easy as clicking on the data you need",https://www.indiehackers.site/product/parsehub,2024/06/23
Awesome Homelab,Tools,Awesome,Free,https://www.awesome-homelab.com,Curating Top Apps for Homelab Enthusiasts.,https://www.indiehackers.site/product/awesome-homelab,2024/07/06
NextUI Pro,Design,UI Component,Paid,https://www.nextui.pro,Ship faster  with beautiful components,https://www.indiehackers.site/product/nextui-pro,2024/06/16
Mantine,Design,UI Component,Free,https://mantine.dev,A fully featured React components library,https://www.indiehackers.site/product/mantine,2024/06/30
DynaUI,Design,UI Component,Free & Paid,https://www.dynaui.design,Animated UI Library designed for Developers,https://www.indiehackers.site/product/dynaui,2024/06/23
Float UI,Design,UI Component,Free,https://floatui.com,Build and ship fast with Tailwind CSS UI components,https://www.indiehackers.site/product/float-ui,2024/06/16
dotUI,Design,UI Component,Free,https://dotui.org,"Accessible, mobile friendly, modern UI components.",https://www.indiehackers.site/product/dotui,2024/07/10
Radix UI,Design,UI Component,Free,https://www.radix-ui.com,"An open source component library optimized for fast development, easy maintenance, and accessibility. Just import and go—no configuration required.",https://www.indiehackers.site/product/radix-ui,2024/06/22
Tailsc,Design,UI Component,Free,https://tailsc.com,Free Tailwind CSS components to build your websites even faster,https://www.indiehackers.site/product/tailsc,2024/06/24
Magic UI,Design,UI Component,Free & Paid,https://magicui.design,"UI library for Design Engineers 20+ free and open-source animated components built with React, Typescript, Tailwind CSS, and Framer Motion. 100% open-source, and customizable.",https://www.indiehackers.site/product/magic-ui,2024/06/03
Versoly UI,Design,UI Component,Free,https://versoly.com/versoly-ui,Tailwind CSS components library based on Bootstrap,https://www.indiehackers.site/product/versoly-ui,2024/06/16
Shadcn/ui,Design,UI Component,Free,https://ui.shadcn.com,Build your component library Beautifully designed components that you can copy and paste into your apps. Accessible. Customizable. Open Source.,https://www.indiehackers.site/product/shadcn-ui,2024/06/08
Daisy UI,Design,UI Component,Paid,https://daisyui.com/store/?aff=MEzPR,The most popular component library  for Tailwind CSS. daisyUI adds component class names to Tailwind CSS so you can make beautiful websites faster than ever.,https://www.indiehackers.site/product/daisy-ui,2024/06/16
NextUI,Design,UI Component,Free,https://nextui.org,"Beautiful, fast and modern React UI library.",https://www.indiehackers.site/product/nextui,2024/06/16
Shadcn Vue,Design,UI Component,Free,https://www.shadcn-vue.com,Beautifully designed components that you can copy and paste into your apps. Accessible. Customizable. Open Source.,https://www.indiehackers.site/product/shadcn-vue,2024/06/29
Uiverse,Design,UI Component,Free,https://uiverse.io,Universe of UI; Hundreds of Open Source UI elements,https://www.indiehackers.site/product/uiverse,2024/07/10
Tailspark,Design,UI Component,Free & Paid,https://tailspark.co,350+ Free Tailwind CSS Components and Templates. Designed and crafted by Experts to help you build you next website in minutes.,https://www.indiehackers.site/product/tailspark,2024/06/20
Shadcn Extension,Design,UI Component,Free,https://shadcn-extension.vercel.app,"An open source component collection , that extends your ui library , built using shadcn component. ",https://www.indiehackers.site/product/shadcn-extension,2024/06/22
UILibHub,Design,UI Component,Free,https://uilibhub.com,Discover Best UI Libraries for React and Vue,https://www.indiehackers.site/product/uilibhub,2024/07/11
